id,name,type,area,description,image1,image2,image3,website,phone,address,amenities,featured,slug,authorName,publishedDate,modifiedDate,directionsLink
144,Rapunzel’s Coffee & Books,Coffee Shops,Lovingston,"Eclectic arts venue, used bookstore, and coffee shop that hosts live music three nights a week and pours Nelson County beer, wine, and cider in a living-room-style space with free Wi-Fi.",https://nelsoncounty.com/wp-content/uploads/2021/11/Rapunzels-Coffee-Books-S.jpg,,,https://www.rapunzelscoffeeandbooks.org/,(434) 263-6660,"956 Front Street, Lovingston, VA 22949",Retail; Live Music; Wi-Fi; Beer; Cider; Wine; Local Ingredients; Coffee; Tea,TRUE,rapunzels-coffee-books,josh,2021-11-14,2024-06-13,https://www.google.com/maps/dir/?api=1&destination=956%20Front%20Street%2C%20Lovingston%2C%20VA%2022949
566,Sweet Bliss Bakery,Coffee Shops,Nellysford,"Handcrafts cheesecakes, cakes, and pastries with local seasonal ingredients, plus Virginia’s Finest soups and a specialty quiche made fresh daily.",https://nelsoncounty.com/wp-content/uploads/2024/05/Sweet-Bliss-Bakery.jpg,,,https://www.facebook.com/thecheesecakelady123/,(434) 465-6776,"2789 Rockfish Valley Highway, Nellysford, VA 22958",Local Ingredients; Seasonal Menu; Coffee; Tea; Cafe,FALSE,sweet-bliss-bakery,josh,2024-05-16,2024-06-12,https://www.google.com/maps/dir/?api=1&destination=2789%20Rockfish%20Valley%20Highway%2C%20Nellysford%2C%20VA%2022958
572,Terrace Café,Coffee Shops,Wintergreen Resort,"Wintergreen Resort café pouring Starbucks beverages with breakfast sandwiches, sweet treats, and warm specialty drinks for skiers and resort guests.",https://nelsoncounty.com/wp-content/uploads/2024/05/terrace-cafe.jpg,,,https://www.wintergreenresort.com/terrace-cafe/,(434) 325-8080,"39 Mountain Inn Loop, Wintergreen, VA 22958",Breakfast; Desserts; Seasonal Menu; Coffee; Tea; Cafe,FALSE,terrace-cafe-at-wintergreen-resort,josh,2024-05-16,2024-05-16,https://www.google.com/maps/dir/?api=1&destination=39%20Mountain%20Inn%20Loop%2C%20Wintergreen%2C%20VA%2022958
580,Trager Brothers Coffee 1.0,Coffee Shops,Lovingston,Small-batch organic roastery and café in downtown Lovingston roasting to order and serving certified organic coffee sourced through long-term sustainable partnerships.,https://nelsoncounty.com/wp-content/uploads/2024/05/Trager-Brothers-Coffee-1.0.jpg,,,https://www.tbcroasters.com/,(434) 996-3138,"486 Front Street, Lovingston, VA 22949",Coffee; Organic; Order Pickup; Tea; Cafe,TRUE,trager-brothers-coffee-1-0,josh,2024-05-16,2025-07-04,https://www.google.com/maps/dir/?api=1&destination=486%20Front%20Street%2C%20Lovingston%2C%20VA%2022949
583,Trager Brothers Coffee 2.0,Coffee Shops,Afton,"Organic coffeehouse at the Rockfish Valley School campus with freshly roasted beans, espresso drinks, and grab-and-go service from Trager Brothers Coffee.",https://nelsoncounty.com/wp-content/uploads/2024/05/Trager-Brothers-Coffee-2.0.jpg,,,https://www.tbcroasters.com/,(434) 263-8916,"190 Rockfish Valley School Lane, Afton, VA 22920",Coffee; Organic; Bar; Tea; Cafe,FALSE,trager-brothers-coffee-2-0,josh,2024-05-16,2025-07-04,https://www.google.com/maps/dir/?api=1&destination=190%20Rockfish%20Valley%20School%20Lane%2C%20Afton%2C%20VA%2022920
595,Afton Market,Markets & Delis,Afton,"Locally owned convenience store and gas station with a breakfast-and-lunch deli known for fried chicken, fresh coffee, and fountain drinks.",https://nelsoncounty.com/wp-content/uploads/2024/05/afton-market.jpg,,,https://nelsoncounty.com/explore/afton-market/,(540) 456-6111,"10185 Rockfish Valley Highway, Afton, VA 22920",Retail; Fuel; Breakfast; Deli; Coffee; Tea; Lunch; Market,FALSE,afton-market,josh,2024-05-16,2024-06-12,https://www.google.com/maps/dir/?api=1&destination=10185%20Rockfish%20Valley%20Highway%2C%20Afton%2C%20VA%2022920
599,Ashley’s Market,Markets & Delis,Afton,"Family-run convenience and gas stop with a deli serving breakfast biscuits, lunch sandwiches, fried chicken, and deli salads.",https://nelsoncounty.com/wp-content/uploads/2024/05/Ashleys-Market-1.jpg,https://nelsoncounty.com/wp-content/uploads/2024/05/Ashleys-Market.jpg,,https://www.facebook.com/ashleysmaket151/,(434) 361-2087,"6445 Rockfish Valley Highway, Afton, VA 22920",Fuel; Breakfast; Deli; Lunch; Market,FALSE,ashleys-market,josh,2024-05-16,2024-06-13,https://www.google.com/maps/dir/?api=1&destination=6445%20Rockfish%20Valley%20Highway%2C%20Afton%2C%20VA%2022920
604,Chicken Coop,Markets & Delis,Lovingston,"Counter-service kitchen inside Nelson Food Mart offering fried chicken, barbecue, burgers, and sandwiches made to order.",https://nelsoncounty.com/wp-content/uploads/2024/05/chicken-coop.jpg,,,https://nelsoncounty.com/explore/chicken-coop/,(434) 263-7818,"40 Front Street, Lovingston, VA 22949",BBQ; Retail; Full Kitchen; Market; Deli,FALSE,chicken-coop,josh,2024-05-16,2024-06-12,https://www.google.com/maps/dir/?api=1&destination=40%20Front%20Street%2C%20Lovingston%2C%20VA%2022949
607,Colleen Deli,Markets & Delis,Arrington,"Exxon deli serving all-day breakfast, daily lunch specials, sandwiches, wraps, and homemade baked goods with a summertime salad bar.",https://nelsoncounty.com/wp-content/uploads/2024/05/colleen-deli.jpg,,,https://nelsoncounty.com/explore/colleen-deli/,(434) 263-8300,"4071 Thomas Nelson Hwy, Arrington, VA 22922",Breakfast; Lunch; Bar; Seasonal Menu; Bakery; Baked Goods; Deli; Market,FALSE,colleen-deli,josh,2024-05-17,2024-06-13,https://www.google.com/maps/dir/?api=1&destination=4071%20Thomas%20Nelson%20Hwy%2C%20Arrington%2C%20VA%2022922
610,Corner Market,Markets & Delis,Schuyler,Neighborhood convenience store and gas station with a short-order deli serving breakfast biscuits and hot lunch items.,https://nelsoncounty.com/wp-content/uploads/2024/05/corner-market.jpg,,,https://nelsoncounty.com/explore/corner-market/,(434) 263-5500,"11309 James River Road, Shipman, VA 22971",Retail; Fuel; Breakfast; Deli; Lunch; Market,FALSE,corner-market,josh,2024-05-17,2024-06-13,https://www.google.com/maps/dir/?api=1&destination=11309%20James%20River%20Road%2C%20Shipman%2C%20VA%2022971
614,Graves Grocery & Deli,Markets & Delis,Nellysford,"Local grocery, gas, and deli stop with breakfast and lunch service for travelers along Route 151.",https://nelsoncounty.com/wp-content/uploads/2024/05/Graves-Grocery-Deli.jpg,,,https://nelsoncounty.com/explore/graves-grocery-deli/,(434) 361-2504,"1779 Rockfish Valley Highway, Nellysford, VA 22958",Retail; Fuel; Breakfast; Lunch; Deli; Market,FALSE,graves-grocery-deli,josh,2024-05-17,2024-06-13,https://www.google.com/maps/dir/?api=1&destination=1779%20Rockfish%20Valley%20Highway%2C%20Nellysford%2C%20VA%2022958
617,Hickman’s Exxon Grocery,Markets & Delis,Roseland,"Exxon convenience store with breakfast and lunch deli, full game checking station, and hunting supplies.",https://nelsoncounty.com/wp-content/uploads/2024/05/Hickmans-Exxon-Grocery.jpg,,,https://nelsoncounty.com/explore/hickmans-exxon-grocery/,(434) 361-1205,"1311 Beech Grove Road, Roseland, VA 22967",Fuel; Breakfast; Lunch; Deli; Hunting; Market,FALSE,hickmans-exxon-grocery,josh,2024-05-17,2024-05-17,https://www.google.com/maps/dir/?api=1&destination=1311%20Beech%20Grove%20Road%2C%20Roseland%2C%20VA%2022967
620,IGA Blue Ridge Grocery,Markets & Delis,Nellysford,"Community supermarket providing full groceries, everyday essentials, and friendly service in the Rockfish Valley.",https://nelsoncounty.com/wp-content/uploads/2024/05/IGA-Blue-Ridge-Grocery.jpg,,,https://nelsoncounty.com/explore/iga-blue-ridge-grocery/,(434) 361-1105,"2797 Rockfish Valley Highway, Nellysford, VA 22958",Grocery; Market; Local Ingredients; Curbside Pickup; Parking; Deli,FALSE,iga-blue-ridge-grocery,josh,2024-05-17,2024-06-13,https://www.google.com/maps/dir/?api=1&destination=2797%20Rockfish%20Valley%20Highway%2C%20Nellysford%2C%20VA%2022958
623,Ike’s Market & Deli,Markets & Delis,Schuyler,"Riverside convenience store and deli featuring hot menu specials, grab-and-go items, and a game checking station.",https://nelsoncounty.com/wp-content/uploads/2024/05/Ikes-Market-Deli.jpg,,,https://nelsoncounty.com/explore/ikes-market-deli/,(434) 831-1185,"6597 Rockfish River Road, Schuyler, VA 22969",Retail; Deli; Hunting; Market,TRUE,ikes-market-deli,josh,2024-05-17,2024-06-13,https://www.google.com/maps/dir/?api=1&destination=6597%20Rockfish%20River%20Road%2C%20Schuyler%2C%20VA%2022969
628,Indian Oven,Markets & Delis,Lovingston,"Family-run Indian restaurant serving curries, tandoori favorites, and coconut-forward dishes crafted with fresh ingredients in a welcoming setting.",https://nelsoncounty.com/wp-content/uploads/2024/05/indian-oven.jpg,,,https://nelsoncounty.com/explore/indian-oven/,(434) 263-4080,"10749 Thomas Nelson Hwy, Lovingston, VA 22949",Takeout; Family Friendly; Market; Deli,FALSE,indian-oven,josh,2024-05-17,2024-06-13,https://www.google.com/maps/dir/?api=1&destination=10749%20Thomas%20Nelson%20Hwy%2C%20Lovingston%2C%20VA%2022949
632,Mac’s Country Store,Markets & Delis,Roseland,"Country store at the crossroads of Routes 151 and 56 with breakfast, lunch, dinner plates, famous fried chicken, and antiques for sale.",https://nelsoncounty.com/wp-content/uploads/2024/05/Macs-Country-Store-1.jpg,https://nelsoncounty.com/wp-content/uploads/2024/05/Macs-Country-Store.jpg,https://nelsoncounty.com/wp-content/uploads/2024/05/Shadys-Place.jpg,https://nelsoncounty.com/explore/macs-country-store/,(434) 277-5305,"7023 Patrick Henry Highway, Roseland, VA 22967",Breakfast; Lunch; Dinner; Takeout; Market; Deli,FALSE,macs-country-store,josh,2024-05-17,2024-05-17,https://www.google.com/maps/dir/?api=1&destination=7023%20Patrick%20Henry%20Highway%2C%20Roseland%2C%20VA%2022967
639,Subway,Markets & Delis,Lovingston,"Subway franchise in Annie Land Plaza making customizable sandwiches, salads, and wraps seven days a week.",https://nelsoncounty.com/wp-content/uploads/2024/05/subway-1.jpg,https://nelsoncounty.com/wp-content/uploads/2024/05/subway.jpg,,https://restaurants.subway.com/united-states/va/lovingston/65-callohill-drive,(434) 263-6800,"65 Callohill Drive, Lovingston, VA 22949",Deli; Market,FALSE,subway,josh,2024-05-17,2024-06-13,https://www.google.com/maps/dir/?api=1&destination=65%20Callohill%20Drive%2C%20Lovingston%2C%20VA%2022949
643,The Market at Wintergreen,Markets & Delis,Wintergreen Resort,"Wintergreen Resort’s convenience market offering groceries, deli meals, branded apparel, and fuel for mountain guests.",https://nelsoncounty.com/wp-content/uploads/2024/05/The-Market-at-Wintergreen.jpg,,,https://nelsoncounty.com/explore/the-market-at-wintergreen/,(434) 325-8224,"189 Mountain Inn Loop, Wintergreen, VA 22958",Deli; Resort; Fuel; Market,FALSE,the-market-at-wintergreen,josh,2024-05-17,2024-06-13,https://www.google.com/maps/dir/?api=1&destination=189%20Mountain%20Inn%20Loop%2C%20Wintergreen%2C%20VA%2022958
646,Williams Grocery,Markets & Delis,Schuyler,"Rural grocery and gas station carrying local honey, bait, and fishing supplies alongside everyday essentials.",https://nelsoncounty.com/wp-content/uploads/2024/05/Williams-Grocery.jpg,,,https://nelsoncounty.com/explore/williams-grocery/,(434) 263-4746,"439 Williamstown Road, Shipman, VA 22971",Retail; Fuel; Local Ingredients; Market; Deli; Water Sports,FALSE,williams-grocery,josh,2024-05-17,2024-06-13,https://www.google.com/maps/dir/?api=1&destination=439%20Williamstown%20Road%2C%20Shipman%2C%20VA%2022971
649,Ann’s Family Restaurant,Restaurants,Arrington,Ann’s Family Restaurant serves classic country cooking with daily specials and fresh vegetables for dine-in comfort in Arrington.,https://nelsoncounty.com/wp-content/uploads/2024/05/Anns-Family-Restaurant.jpg,,,https://nelsoncounty.com/explore/anns-family-restaurant/,(434) 263-8110,"1170 Thomas Nelson Highway, Arrington, VA 22922",Family Friendly,FALSE,anns-family-restaurant,josh,2024-05-17,2024-06-13,https://www.google.com/maps/dir/?api=1&destination=1170%20Thomas%20Nelson%20Highway%2C%20Arrington%2C%20VA%2022922
653,Basic Necessities,Restaurants,Nellysford,"Basic Necessities is a European-inspired café, wine, and cheese shop in the Rockfish Valley serving soups, salads, seasonal dinners with live music, and a popular Sunday brunch.",https://nelsoncounty.com/wp-content/uploads/2024/05/Basic-Necessities-e1758127777467.jpg,,,https://nelsoncounty.com/explore/basic-necessities/,(434) 361-1776,"2226 Rockfish Valley Highway, Nellysford, VA 22958",Wine; Retail; Dinner; Live Music; Brunch,FALSE,basic-necessities,josh,2024-05-17,2024-06-13,https://www.google.com/maps/dir/?api=1&destination=2226%20Rockfish%20Valley%20Highway%2C%20Nellysford%2C%20VA%2022958
656,Blue Mountain Brewery,Breweries & Cideries,Afton,Route 151 brewpub pouring flagship and seasonal ales alongside a from-scratch kitchen with sweeping Blue Ridge views.,https://nelsoncounty.com/wp-content/uploads/2024/05/Blue-Mountain-Brewery.jpg,,,https://www.bluemountainbrewery.com/,(540) 456-8020,"9519 Critzers Shop Road, Afton, VA 22920",Outdoor Seating; Events; Family Friendly; Tastings; Scenic Views; Full Kitchen; Beer; Cider,FALSE,blue-mountain-brewery,josh,2024-05-17,2024-06-13,https://www.google.com/maps/dir/?api=1&destination=9519%20Critzers%20Shop%20Road%2C%20Afton%2C%20VA%2022920
660,Blue Ridge Pig,Restaurants,Nellysford,"Blue Ridge Pig is a roadside smokehouse known for Strawberry Goodwin’s on-site smoked meats, from classic pulled pork with slaw to Turkey Croissants with signature dill sauce.",https://nelsoncounty.com/wp-content/uploads/2024/05/Blue-Ridge-Pig.jpg,,,https://nelsoncounty.com/explore/blue-ridge-pig/,(434) 361-1170,"2198 Rockfish Valley Highway, Nellysford, VA 22958",BBQ; Takeout; Scenic Views,FALSE,blue-ridge-pig,josh,2024-05-17,2024-06-13,https://www.google.com/maps/dir/?api=1&destination=2198%20Rockfish%20Valley%20Highway%2C%20Nellysford%2C%20VA%2022958
663,Bold Kitchen at Bold Rock,Restaurants,Nellysford,"Bold Kitchen at Bold Rock serves scratch-made pub fare, sharable plates, and seasonal specials alongside cider flights inside the Bold Rock Cider Barn on Nelson 151.",https://nelsoncounty.com/wp-content/uploads/2024/05/Bold-Kitchen-at-Bold-Rock.jpg,,,https://nelsoncounty.com/?post_type=portfolio&p=663,,"1020 Rockfish Valley Highway, Nellysford, VA 22958",Bar; Cider; Tastings; Full Kitchen,FALSE,bold-kitchen-at-bold-rock,josh,1970-01-01,2024-05-17,https://www.google.com/maps/dir/?api=1&destination=1020%20Rockfish%20Valley%20Highway%2C%20Nellysford%2C%20VA%2022958
666,Chen’s Restaurant,Restaurants,Lovingston,"Chen’s Restaurant in Lovingston prepares made-to-order Chinese favorites for dine-in or takeout, with weekday lunch specials in Annie Land Plaza just off Route 29.",https://nelsoncounty.com/wp-content/uploads/2024/05/Chens-Restaurant.jpg,,,https://nelsoncounty.com/explore/chens-restaurant/,(434) 263-8865,"73 Callohill Drive, Lovingston, VA 22949",Takeout; Lunch,FALSE,chens-restaurant,josh,2024-05-17,2024-06-13,https://www.google.com/maps/dir/?api=1&destination=73%20Callohill%20Drive%2C%20Lovingston%2C%20VA%2022949
669,Chirio’s Pizza,Restaurants,Nellysford,"Chirio’s Pizza is Nelson County’s longest-running pizzeria, serving New York-style pies, subs, salads, and ice cream with eat-in, takeout, and delivery options from Valley Green Shopping Center.",https://nelsoncounty.com/wp-content/uploads/2024/05/Chirios-Pizza.jpg,,,https://nelsoncounty.com/explore/chirios-pizza/,(434) 361-9188,"2777 Rockfish Valley Highway, Nellysford, VA 22958",Family Friendly; Takeout; Delivery; Desserts; Pizza,FALSE,chirios-pizza,josh,2024-05-17,2024-06-13,https://www.google.com/maps/dir/?api=1&destination=2777%20Rockfish%20Valley%20Highway%2C%20Nellysford%2C%20VA%2022958
672,Coquito Kitchen,Restaurants,Nellysford,"Coquito Kitchen blends Argentine and Southern comfort fare out of the Rockfish Valley Community Center, offering lunch Thursday through Saturday with rotating empanadas, sandwiches, and sides.",https://nelsoncounty.com/wp-content/uploads/2024/05/Coquito-Kitchen.jpg,,,https://nelsoncounty.com/explore/coquito-kitchen/,,"190 Rockfish School Lane, Afton, VA 22920",Lunch; Full Kitchen,FALSE,coquito-kitchen,josh,2024-05-17,2024-06-13,https://www.google.com/maps/dir/?api=1&destination=190%20Rockfish%20School%20Lane%2C%20Afton%2C%20VA%2022920
675,Devils Backbone Brewing,Restaurants,Roseland,"Devils Backbone Basecamp pairs a wood-fired kitchen with 16 taps of house beer, coffee bar mornings, and meadow seating for concerts and events.",https://nelsoncounty.com/wp-content/uploads/2024/05/Devils-Backbone-Brewing.jpg,,,https://www.dbbrewingcompany.com/visit/basecamp/,(434) 361-1001,"200 Mosbys Run, Roseland, VA 22967",Beer; Outdoor Seating; Live Music; Full Kitchen; Coffee; Tea,FALSE,devils-backbone-brewing,josh,2024-05-17,2024-05-18,https://www.google.com/maps/dir/?api=1&destination=200%20Mosbys%20Run%2C%20Roseland%2C%20VA%2022967
678,El Mariachi Mexican Food,Restaurants,Lovingston,El Mariachi Mexican Food serves classic Mexican dishes in Lovingston with weekday and weekend hours extending to 10 pm and gift certificates available.,https://nelsoncounty.com/wp-content/uploads/2024/05/El-Mariachi-Mexican-Food.jpg,,,https://nelsoncounty.com/explore/el-mariachi-mexican-food/,(434) 263-5999,"165 Front Street, Lovingston, VA 22949",Retail; Local Ingredients,FALSE,el-mariachi-mexican-food,josh,2024-05-17,2025-05-13,https://www.google.com/maps/dir/?api=1&destination=165%20Front%20Street%2C%20Lovingston%2C%20VA%2022949
681,Fire & Frost Wood Fired Bakehouse,Restaurants,Nellysford,Fire & Frost Wood Fired Bakehouse brings wood-fired pizzas and Italian-inspired fare to Wintergreen Resort in a warm alpine setting.,https://nelsoncounty.com/wp-content/uploads/2024/05/Fire-Frost-Wood-Fired-Bakehouse.jpg,,,https://nelsoncounty.com/explore/fire-frost-wood-fired-bakehouse/,(434) 326-5639,"121 Blue Ridge Drive, Roseland, VA 22967",Scenic Views; Resort; Pizza,FALSE,fire-frost-wood-fired-bakehouse,josh,2024-05-17,2024-06-13,https://www.google.com/maps/dir/?api=1&destination=121%20Blue%20Ridge%20Drive%2C%20Roseland%2C%20VA%2022967
688,Iron and Ale,Restaurants,Nellysford,"Iron & Ale is a chef-driven bistro in Stoney Creek offering rotating menus, patio dining, and curated wine and beer lists for date nights and gatherings.",https://nelsoncounty.com/wp-content/uploads/2024/05/Iron-and-Ale.jpg,,,https://nelsoncounty.com/explore/iron-and-ale/,(540) 440-2140,"1354 Stoney Creek West, Nellysford, VA 22958",Seasonal Menu; Wine; Outdoor Seating; Beer,FALSE,iron-and-ale,josh,2024-05-17,2024-08-12,https://www.google.com/maps/dir/?api=1&destination=1354%20Stoney%20Creek%20West%2C%20Nellysford%2C%20VA%2022958
691,McDonald’s,Restaurants,Lovingston,"McDonald’s in Lovingston serves breakfast, lunch, and dinner daily with extended hours to midnight on Fridays and Saturdays along Route 29.",https://nelsoncounty.com/wp-content/uploads/2024/05/McDonalds.jpg,,,https://nelsoncounty.com/explore/mcdonalds/,(434) 263-8066,"44 Callohill Drive, Lovingston, VA 22949",Drive-Thru; Breakfast; Lunch; Dinner,FALSE,mcdonalds,josh,2024-05-17,2024-06-12,https://www.google.com/maps/dir/?api=1&destination=44%20Callohill%20Drive%2C%20Lovingston%2C%20VA%2022949
694,Montebello Country Store & Cafe,Restaurants,Montebello,"Montebello Country Store & Cafe is a fifth-generation general store near Crabtree Falls with groceries, camping supplies, and a cafe serving chili and country fare.",https://nelsoncounty.com/wp-content/uploads/2024/05/Montebello-Country-Store-Cafe.jpg,,,https://nelsoncounty.com/explore/montebello-country-store-cafe/,(540) 377-2650,"15072 Crabtree Falls Highway, Montebello, VA 24464",Retail; Family Friendly; Water Sports,FALSE,montebello-country-store-cafe,josh,2024-05-17,2025-04-28,https://www.google.com/maps/dir/?api=1&destination=15072%20Crabtree%20Falls%20Highway%2C%20Montebello%2C%20VA%2024464
698,Paulie's Pig Out,Restaurants,Afton,"Paulie’s Pig Out is an Afton barbecue joint serving smoked pork and chicken platters, classic sides, and homemade desserts along Route 151.",https://nelsoncounty.com/wp-content/uploads/2024/05/Paulies-Pig-Out.jpg,,,https://nelsoncounty.com/explore/paulies-pig-out/,(434) 361-2001,"7376 Rockfish Valley Highway, Afton, VA 22920",BBQ,FALSE,paulies-pig-out,josh,2024-05-17,2024-06-13,https://www.google.com/maps/dir/?api=1&destination=7376%20Rockfish%20Valley%20Highway%2C%20Afton%2C%20VA%2022920
701,Smokin’ Barrel Restaurant,Restaurants,Arrington,"Smokin’ Barrel Restaurant operates inside Blue Mountain Barrel House with pub fare, BBQ plates, burgers, soups, and desserts for taproom guests.",https://nelsoncounty.com/wp-content/uploads/2024/05/Smokin-Barrel-Restaurant.jpg,,,https://nelsoncounty.com/explore/smokin-barrel-restaurant/,(434) 226-2450,"495 Cooperative Way, Arrington, VA 22922",Beer; Scenic Views; BBQ; Bar; Family Friendly; Full Kitchen,FALSE,smokin-barrel-restaurant,josh,2024-05-17,2024-06-13,https://www.google.com/maps/dir/?api=1&destination=495%20Cooperative%20Way%2C%20Arrington%2C%20VA%2022922
704,The Copper Mine Bistro,Restaurants,Roseland,"The Copper Mine Bistro anchors Wintergreen’s Blackrock Village with traditional breakfast, Mediterranean-inspired dinners, and weekend lunches during ski season.",https://nelsoncounty.com/wp-content/uploads/2024/05/The-Copper-Mine-Bistro.jpg,https://nelsoncounty.com/wp-content/uploads/2024/05/The-Edge.jpg,,https://nelsoncounty.com/explore/the-copper-mine-bistro/,(434) 325-8090,"39 Wintergreen Drive, Roseland, VA 22967",Breakfast; Lunch; Seasonal Menu; Dinner,FALSE,the-copper-mine-bistro,josh,2024-05-17,2024-06-13,https://www.google.com/maps/dir/?api=1&destination=39%20Wintergreen%20Drive%2C%20Roseland%2C%20VA%2022967
710,The Edge,Restaurants,Wintergreen Resort,"The Edge is Wintergreen’s casual slope-side restaurant with mountain views, hearty comfort food, and a lively bar with seasonal live music.",https://nelsoncounty.com/wp-content/uploads/2024/05/The-Edge.jpg,,,https://nelsoncounty.com/explore/the-edge/,(434) 325-8080,"11 Grassy Ridge Road, Wintergreen, VA 22958",Scenic Views; Snow Sports; Bar; Live Music; Seasonal Menu,FALSE,the-edge,josh,2024-05-17,2024-06-13,https://www.google.com/maps/dir/?api=1&destination=11%20Grassy%20Ridge%20Road%2C%20Wintergreen%2C%20VA%2022958
715,The Farmhouse at Veritas,Restaurants,Afton,"The Farmhouse at Veritas hosts four-course, wine-paired farm-to-table dinners Wednesday through Sunday in an intimate setting on the Veritas vineyard estate.",https://nelsoncounty.com/wp-content/uploads/2024/05/Veritas-Farmhouse-Dining.jpg,,,https://nelsoncounty.com/explore/the-farmhouse-at-veritas/,(540) 456-8100,"72 Saddleback Farm, Afton, VA 22920",Wine; Farm,FALSE,the-farmhouse-at-veritas,josh,2024-05-17,2024-05-17,https://www.google.com/maps/dir/?api=1&destination=72%20Saddleback%20Farm%2C%20Afton%2C%20VA%2022920
718,Vito’s Pizza & Italian Grill,Restaurants,Lovingston,"Vito’s Pizza & Italian Grill is a family-owned Italian restaurant in Lovingston serving pizzas, pasta, and grill favorites rooted in chef Salvatore Mannino’s Sicilian heritage.",https://nelsoncounty.com/wp-content/uploads/2024/05/Vitos-Pizza-Italian-Grill.jpg,,,https://nelsoncounty.com/explore/vitos-pizza-italian-grill/,(434) 263-8688,"8181 Thomas Nelson Highway, Lovingston, VA 22949",Family Friendly; Pizza; Full Kitchen,FALSE,vitos-pizza-italian-grill,josh,2024-05-17,2024-06-13,https://www.google.com/maps/dir/?api=1&destination=8181%20Thomas%20Nelson%20Highway%2C%20Lovingston%2C%20VA%2022949
721,Black Bear Creamery,Restaurants,Nellysford,"Black Bear Creamery scoops homemade ice cream, shakes, and sundaes for locals and visitors in Nellysford.",https://nelsoncounty.com/wp-content/uploads/2024/05/Black-Bear-Creamery.jpg,,,https://nelsoncounty.com/explore/black-bear-creamery/,(434) 263-8916,"18 Pheasant Run, Nellysford, VA 22958",Desserts; Family Friendly,FALSE,black-bear-creamery,josh,2024-05-17,2024-06-12,https://www.google.com/maps/dir/?api=1&destination=18%20Pheasant%20Run%2C%20Nellysford%2C%20VA%2022958
729,Dickie Brothers Orchard,Farms & Orchards,Roseland,"Century Farm orchard growing heirloom apples alongside berries, pumpkins, cider, and farm-made goods with pick-your-own seasons from summer through fall.",https://nelsoncounty.com/wp-content/uploads/2024/05/Dickie-Brothers-Orchard.jpg,https://nelsoncounty.com/wp-content/uploads/2024/05/IMG_2655-scaled.jpeg,,https://dickiebrothers.com/,(434) 277-5516,"2685 Dickie Road, Roseland, VA 22967",Farm; Cider; Local Ingredients,FALSE,dickie-brothers-orchard,josh,2024-05-17,2025-10-13,https://www.google.com/maps/dir/?api=1&destination=2685%20Dickie%20Road%2C%20Roseland%2C%20VA%2022967
733,Drumheller’s Orchard,Farms & Orchards,Lovingston,"Family orchard and bakery showcasing classic Virginia apple varieties, house cider, and fall festivals with hayrides, baked goods, and pet-friendly grounds.",https://nelsoncounty.com/wp-content/uploads/2024/05/Drumhellers-Orchard.jpg,,,https://www.drumhellersorchard.com/,(434) 263-5036,"1130 Drumheller Orchard Lane, Lovingston, VA 22949",Bakery; Cider; Farm; Pet Friendly; Local Ingredients,FALSE,drumhellers-orchard,josh,2024-05-18,2024-06-13,https://www.google.com/maps/dir/?api=1&destination=1130%20Drumheller%20Orchard%20Lane%2C%20Lovingston%2C%20VA%2022949
742,Saunders Brothers Farm Market,Farms & Orchards,Piney River,"Saunders Brothers’ farm market pairs homegrown peaches, apples, and nursery stock with a country shop featuring meats, baked goods, peach ice cream, and weekend events.",https://nelsoncounty.com/wp-content/uploads/2024/05/Saunders-Brothers-Farm-Market.jpg,,,https://www.saundersbrothers.com/,(434) 277-5455,"2717 Tye Brook Highway, Piney River, VA 22964",Farm; Market; Desserts; Bakery; Local Ingredients; Family Friendly,FALSE,saunders-brothers-farm-market,josh,2024-05-18,2024-11-20,https://www.google.com/maps/dir/?api=1&destination=2717%20Tye%20Brook%20Highway%2C%20Piney%20River%2C%20VA%2022964
