id,name,type,area,description,image1,image2,image3,website,phone,address,amenities,featured,slug,authorName,publishedDate,modifiedDate,directionsLink
1944,Mars Knob Farm,Farms & Orchards,Roseland,"Mars Knob Farm produces small-batch, chemical-free pantry goods and apothecary items from a historic Roseland homestead.",https://nelsoncounty.com/wp-content/uploads/2024/10/IMG_2726.jpeg,,,https://nelsoncounty.com/explore/mars-knob-farm/,,"Roseland, VA 22967",Farm; Family Friendly; Local Ingredients,FALSE,marsknob,WG,2024-10-10,2024-10-10,https://www.google.com/maps/dir/?api=1&destination=Roseland%2C%20VA%2022967
2024,Crestvue Cottage,Cabins & Cottages,Arrington,"Crestvue Cottage is a renovated 340 sq ft farm guest house with hiking trails, stargazing deck, and full kitchenette minutes from Route 29 wineries.",https://nelsoncounty.com/wp-content/uploads/2025/01/Crestvue-Cottage-Ext.jpg,https://nelsoncounty.com/wp-content/uploads/2025/01/Crestvue-Cottage-Int.jpg,,https://nelsoncounty.com/explore/crestvue-cottage/,,"Arrington, VA 22922",Farm; Outdoor Seating; Full Kitchen; Cabins; Lodging,FALSE,crestvue-cottage,josh,2025-01-07,2025-01-28,https://www.google.com/maps/dir/?api=1&destination=Arrington%2C%20VA%2022922
2056,Sentosa Cabin,Cabins & Cottages,Schuyler,"Sentosa Cabin is a one-bedroom woodland retreat with mountain views, Wi-Fi, full kitchen, and two miles of private trails to the Rockfish River.",https://nelsoncounty.com/wp-content/uploads/2025/01/Sentosa-Cabin-Exterior.jpg,https://nelsoncounty.com/wp-content/uploads/2025/01/Sentosa-Cabin-Interior.jpg,,https://nelsoncounty.com/explore/sentosa-cabin/,,"Nellysford, VA 22958",Scenic Views; Cabins; Outdoor Seating; Wi-Fi; Full Kitchen; Lodging,FALSE,sentosa-cabin,josh,2025-01-27,2025-01-28,https://www.google.com/maps/dir/?api=1&destination=Nellysford%2C%20VA%2022958
2059,Roudy's Retreat,Cabins & Cottages,Montebello,"Roudy’s Retreat sleeps up to ten with a hot tub, private pond, fire pit, and fully stocked kitchen on a secluded Nelson County property.",https://nelsoncounty.com/wp-content/uploads/2025/01/Roudys-Retreat-Exterior.jpg,https://nelsoncounty.com/wp-content/uploads/2025/01/Roudys-Retreat-Interior.jpg,,https://nelsoncounty.com/explore/roudys-retreat/,,"Roseland, VA 22967",Outdoor Seating; Full Kitchen; Pet Friendly; Cabins; Lodging,FALSE,roudys-retreat,josh,2025-01-27,2025-01-28,https://www.google.com/maps/dir/?api=1&destination=Roseland%2C%20VA%2022967
2061,Pachi's Ridge,Cabins & Cottages,Nellysford,"Pachi’s Ridge is a modern three-bedroom cabin on 40 acres with Blue Ridge views, upgraded kitchen, and access to hiking trails and the Rockfish River.",https://nelsoncounty.com/wp-content/uploads/2025/01/Pachis-Ridge-Exterior.jpg,https://nelsoncounty.com/wp-content/uploads/2025/01/Pachis-Ridge-Interior.jpg,,https://nelsoncounty.com/explore/pachis-ridge/,,"Nellysford, VA 22958",Hiking; Scenic Views; Seasonal Menu; Cabins; Full Kitchen; Lodging,FALSE,pachis-ridge,josh,2025-01-27,2025-01-28,https://www.google.com/maps/dir/?api=1&destination=Nellysford%2C%20VA%2022958
2066,Boogie Nights Manor,Cabins & Cottages,Afton,"Boogie Nights Manor is a 4,000 sq ft art-filled vacation home sleeping 12 with retro decor, expansive decks, and pet-friendly amenities along Route 151.",https://nelsoncounty.com/wp-content/uploads/2025/01/Boogie-Nights-Manor-Exterior.jpg,https://nelsoncounty.com/wp-content/uploads/2025/01/Boogie-Nights-Manor-Interior.jpg,,https://nelsoncounty.com/explore/boogie-nights-manor/,,"Afton, VA 22920",Pet Friendly; Cabins; Lodging,FALSE,boogie-nights-manor,josh,2025-01-27,2025-01-28,https://www.google.com/maps/dir/?api=1&destination=Afton%2C%20VA%2022920
2068,The Big Tiny House,Cabins & Cottages,Afton,"The Big Tiny House is a luxury Escape Traveler XL tiny home with full kitchen, soaking tub, loft, and Brew Ridge Trail access.",https://nelsoncounty.com/wp-content/uploads/2025/01/The-Big-Tiny-House-Exterior.jpg,https://nelsoncounty.com/wp-content/uploads/2025/01/The-Big-Tiny-House-Interior.jpg,,https://nelsoncounty.com/explore/the-big-tiny-house/,,"Afton, VA 22920",Full Kitchen; Pet Friendly; Cabins; Lodging,FALSE,the-big-tiny-house,josh,2025-01-27,2025-01-28,https://www.google.com/maps/dir/?api=1&destination=Afton%2C%20VA%2022920
2070,Rusty's Retreat,Cabins & Cottages,Afton,"Rusty’s Retreat is a Brew Ridge Trail micro-cabin with queen bed, kitchenette, private fire pit, and donation support for animal rescue.",https://nelsoncounty.com/wp-content/uploads/2025/01/Rustys-Retreat-Exterior.jpg,https://nelsoncounty.com/wp-content/uploads/2025/01/Rustys-Retreat-Interior.jpg,,https://nelsoncounty.com/explore/rustys-retreat/,,"Afton, VA 22920",Cabins; Outdoor Seating; Coffee; Bar; Tea; Full Kitchen; Lodging,FALSE,rustys-retreat,josh,2025-01-27,2025-01-28,https://www.google.com/maps/dir/?api=1&destination=Afton%2C%20VA%2022920
2073,Village Inn,Motels & Inns,Lovingston,Village Inn is a 23-room motel on U.S. 29 north of Lovingston offering value accommodations and onsite staff.,https://nelsoncounty.com/wp-content/uploads/2025/01/Village-Inn-Exterior.jpg,https://nelsoncounty.com/wp-content/uploads/2025/01/Village-Inn-Interior.jpg,,https://nelsoncounty.com/explore/village-inn/,(434) 295-2161,"79 Tanbark Plaza, Lovingston, VA 22949",Lodging,FALSE,village-inn,josh,2025-01-27,2025-01-28,https://www.google.com/maps/dir/?api=1&destination=79%20Tanbark%20Plaza%2C%20Lovingston%2C%20VA%2022949
2076,Cozy Mountain Cottage,Cabins & Cottages,Nellysford,"Cozy Mountain Cottage is a family-friendly rental near Route 151 with wraparound views, porch seating, and proximity to Wintergreen and breweries.",https://nelsoncounty.com/wp-content/uploads/2025/01/Cozy-Mountain-Cottage-Exterior.jpg,https://nelsoncounty.com/wp-content/uploads/2025/01/Cozy-Mountain-Cottage-Interior.jpg,,https://nelsoncounty.com/explore/cozy-mountain-cottage/,,"Roseland, VA 22967",Scenic Views; Wi-Fi; Full Kitchen; Outdoor Seating; Family Friendly; Cabins; Lodging,FALSE,cozy-mountain-cottage,josh,2025-01-27,2025-01-28,https://www.google.com/maps/dir/?api=1&destination=Roseland%2C%20VA%2022967
2080,Piedmont Grove Lodging,Motels & Inns,Roseland,"Piedmont Grove Lodging offers ten hotel-style suites near Route 151 with nightly stays, DreamCloud mattresses, and professional cleanings.",https://nelsoncounty.com/wp-content/uploads/2025/01/Piedmont-Grove-Lodging-Exterior.jpg,https://nelsoncounty.com/wp-content/uploads/2025/01/Piedmont-Grove-Lodging-Interior.jpg,,https://nelsoncounty.com/explore/piedmont-grove-lodging/,(434) 361-1100,"76 Rodes Farm Drive, Nellysford, VA 22958",Lodging,FALSE,piedmont-grove-lodging,josh,2025-01-27,2025-01-28,https://www.google.com/maps/dir/?api=1&destination=76%20Rodes%20Farm%20Drive%2C%20Nellysford%2C%20VA%2022958
2086,Beech Grove Farmhouse,Cabins & Cottages,Roseland,"Beech Grove Farmhouse is a historic three-bedroom home across from Devils Backbone with modern updates, fire pit, and mountain views.",https://nelsoncounty.com/wp-content/uploads/2025/01/Beech-Grove-Farmhouse-Exterior.jpg,https://nelsoncounty.com/wp-content/uploads/2025/01/Beech-Grove-Farmhouse-Interior.jpg,,https://nelsoncounty.com/explore/beech-grove-farmhouse/,,"9519 Critzers Shop Road, Afton, VA 22920",Wi-Fi; Full Kitchen; Scenic Views; Cabins; Lodging,FALSE,beech-grove-farmhouse,josh,2025-01-27,2025-01-28,https://www.google.com/maps/dir/?api=1&destination=9519%20Critzers%20Shop%20Road%2C%20Afton%2C%20VA%2022920
2091,Straw Bale House,Bed and Breakfast,Afton,"Straw Bale House is an eco-friendly custom home on 70 acres near breweries with farm animals, fresh eggs, and private hiking.",https://nelsoncounty.com/wp-content/uploads/2025/01/Straw-Bale-House-Exterior.jpg,https://nelsoncounty.com/wp-content/uploads/2025/01/Straw-Bale-House-Interior.jpg,,https://nelsoncounty.com/explore/straw-bale-house/,,"Nellysford, VA 22958",Farm; Breakfast; Lodging,FALSE,straw-bale-house,josh,2025-01-27,2025-01-28,https://www.google.com/maps/dir/?api=1&destination=Nellysford%2C%20VA%2022958
2095,Blue Ridge Bliss,Cabins & Cottages,Roseland,"Blue Ridge Bliss is a renovated two-bedroom Ledges condo at Wintergreen with sunrise views, updated kitchen, and resort access.",https://nelsoncounty.com/wp-content/uploads/2025/01/Blue-Ridge-Bliss.jpg,https://nelsoncounty.com/wp-content/uploads/2025/01/Blue-Ridge-Bliss-Interior.jpg,,https://nelsoncounty.com/explore/blue-ridge-bliss/,,"46 Ledges Lane, Wintergreen, VA 22958",Scenic Views; Hiking; Resort; Skiing; Full Kitchen; Pet Friendly; Cabins; Lodging,FALSE,blue-ridge-bliss,josh,2025-01-27,2025-01-28,https://www.google.com/maps/dir/?api=1&destination=46%20Ledges%20Lane%2C%20Wintergreen%2C%20VA%2022958
2101,Stays at Lovingston Winery,Cabins & Cottages,Lovingston,"Stays at Lovingston Winery include a renovated farmhouse and private cabin steps from the tasting room with fire pits, porches, and optional chef dinners.",https://nelsoncounty.com/wp-content/uploads/2025/01/LW-farmhouse.jpg,https://nelsoncounty.com/wp-content/uploads/2025/01/LW-cabin.jpg,,https://nelsoncounty.com/explore/stays-at-lovingston-winery/,(434) 263-8467,"885 Freshwater Cove Lane, Lovingston, VA 22949",Wine; Cabins; Lodging; Dinner; Tastings,FALSE,stays-at-lovingston-winery,josh,2025-01-28,2025-01-28,https://www.google.com/maps/dir/?api=1&destination=885%20Freshwater%20Cove%20Lane%2C%20Lovingston%2C%20VA%2022949
2105,The Cottage at Pines End,Cabins & Cottages,Arrington,"The Cottage at Pines End is a hot-tub-equipped cabin with wraparound deck, gas fireplace, and trails to the Tye River and Blue Ridge Railway Trail.",https://nelsoncounty.com/wp-content/uploads/2025/01/The-Cottage-at-Pines-End-Exterior.jpg,https://nelsoncounty.com/wp-content/uploads/2025/01/The-Cottage-at-Pines-End-Interior.jpg,,https://nelsoncounty.com/explore/the-cottage-at-pines-end/,,"Arrington, VA 22922",Outdoor Seating; Fuel; Hiking; Pet Friendly; Scenic Views,FALSE,the-cottage-at-pines-end,josh,2025-01-28,2025-01-28,https://www.google.com/maps/dir/?api=1&destination=Arrington%2C%20VA%2022922
2112,Woodson's Mill House,Cabins & Cottages,Roseland,"Woodson’s Mill House is a craftsman retreat beside historic Woodson’s Mill with lake access, wooded acreage, and convenient access to Charlottesville and Wintergreen.",https://nelsoncounty.com/wp-content/uploads/2025/01/Woodsons-Mill-House.jpg,https://nelsoncounty.com/wp-content/uploads/2025/01/Woodsons-Mill-House-Interior.jpg,,https://nelsoncounty.com/explore/woodsons-mill-house/,,"3211 Lowesville Road, Roseland, VA 22967",Scenic Views; Pet Friendly; Cabins; Lodging,FALSE,woodsons-mill-house,josh,2025-01-28,2025-01-31,https://www.google.com/maps/dir/?api=1&destination=3211%20Lowesville%20Road%2C%20Roseland%2C%20VA%2022967
2118,Harmony Hill Bed & Breakfast,Bed and Breakfast,Arrington,"Harmony Hill Bed & Breakfast offers six themed guest rooms with private baths, fireplaces, and country breakfasts near Route 29 wineries.",https://nelsoncounty.com/wp-content/uploads/2025/01/Harmony-Hill-Bed-and-Breakfast.jpg,https://nelsoncounty.com/wp-content/uploads/2025/01/Harmony-Hill-Bed-Breakfast-Interior.jpg,,https://nelsoncounty.com/explore/harmony-hill-bed-breakfast/,(434) 263-7750,"929 Wilson Hill Road, Arrington, VA 22922",Breakfast; Scenic Views; Lodging,FALSE,harmony-hill-bed-and-breakfast,josh,2025-01-28,2025-02-08,https://www.google.com/maps/dir/?api=1&destination=929%20Wilson%20Hill%20Road%2C%20Arrington%2C%20VA%2022922
2123,Spyrock Lodge,Cabins & Cottages,Montebello,"Spyrock Lodge is a secluded two-bedroom cabin on 11 acres bordering the Appalachian Trail with Wi-Fi, heat/AC, and optional micro cabin.",https://nelsoncounty.com/wp-content/uploads/2025/01/Spyrock-Lodge.jpg,https://nelsoncounty.com/wp-content/uploads/2025/01/Spyrock-Lodge-Interior.jpg,,https://nelsoncounty.com/explore/spyrock-lodge/,,"Montebello, VA 24464",Hiking; Cabins; Wi-Fi; Lodging,FALSE,spyrock-lodge,josh,2025-01-28,2025-01-28,https://www.google.com/maps/dir/?api=1&destination=Montebello%2C%20VA%2024464
2126,The Retreat at Crabtree Falls,Cabins & Cottages,Tyro,"The Retreat at Crabtree Falls spreads across cabins, glamping tents, and forthcoming lodge suites only minutes from Virginia’s highest cascading waterfall. Each accommodation provides bedrooms, full kitchens, and generous living rooms for families and groups, while onsite trails connect directly to Crabtree Falls and mountain viewpoints. A dedicated hospitality team keeps spaces immaculate, arranges hikes, fishing, and winery excursions, and answers special requests so guests enjoy a secluded yet fully supported Blue Ridge escape.",https://nelsoncounty.com/wp-content/uploads/2025/01/The-Retreat-at-Crabtree-Falls.jpg,https://nelsoncounty.com/wp-content/uploads/2025/01/The-Retreat-at-Crabtree-Falls-Interior.jpg,,https://nelsoncounty.com/explore/the-retreat-at-crabtree-falls/,(434) 207-2230,"10777 Crabtree Falls Highway, Tyro, VA 22976",Lodging; Cabins; Scenic Views; Water Sports,FALSE,the-retreat-at-crabtree-falls,josh,2025-01-28,2025-02-07,https://www.google.com/maps/dir/?api=1&destination=10777%20Crabtree%20Falls%20Highway%2C%20Tyro%2C%20VA%2022976
2156,Point of View,Cabins & Cottages,Roseland,"Point of View is a five-bedroom, 5.5-bath Wintergreen resort home with panoramic mountain views, dual entertaining levels, hot tub, game room, and chef kitchen.",https://nelsoncounty.com/wp-content/uploads/2025/01/Point-of-View-Ext.jpg,https://nelsoncounty.com/wp-content/uploads/2025/01/Point-of-View-Int.jpg,,https://nelsoncounty.com/explore/point-of-view/,,"Wintergreen Resort, Roseland, VA 22967",Scenic Views; Full Kitchen; Cabins; Lodging,FALSE,point-of-view,josh,2025-02-07,2025-02-07,https://www.google.com/maps/dir/?api=1&destination=Wintergreen%20Resort%2C%20Roseland%2C%20VA%2022967
2158,The Inn at Blue Mountain Brewery,Cabins & Cottages,Afton,"The Inn at Blue Mountain Brewery is a 4,000 sq ft Cape Cod home beside the brewery with wraparound porch, hot tub, fire pit, and private path to the taproom.",https://nelsoncounty.com/wp-content/uploads/2025/01/The-Inn-at-Blue-Mountain-Brewery.jpg,https://nelsoncounty.com/wp-content/uploads/2025/01/The-Inn-at-Blue-Mountain-Brewery-Interior.jpg,,https://nelsoncounty.com/explore/the-inn-at-blue-mountain-brewery/,,"9519 Critzers Shop Road, Afton, VA 22920",Pool; Beer; Outdoor Seating; Cabins; Lodging,FALSE,the-inn-at-blue-mountain-brewery,josh,2025-02-07,2025-02-07,https://www.google.com/maps/dir/?api=1&destination=9519%20Critzers%20Shop%20Road%2C%20Afton%2C%20VA%2022920
2160,Gracewood,Cabins & Cottages,Afton,"Gracewood is a modernized cottage tucked off Route 151 with two miles of private trails, quiet setting, and easy access to wineries and breweries.",https://nelsoncounty.com/wp-content/uploads/2025/01/Gracewood-Exterior.jpg,https://nelsoncounty.com/wp-content/uploads/2025/01/Gracewood-Interior.jpg,,https://nelsoncounty.com/explore/gracewood/,,"Nellysford, VA 22958",Cabins; Lodging,FALSE,gracewood,josh,2025-02-07,2025-02-07,https://www.google.com/maps/dir/?api=1&destination=Nellysford%2C%20VA%2022958
2162,The Chimneys,Cabins & Cottages,Montebello,"The Chimneys is an 1800s hand-hewn log cabin for unplugged stays, ideal for guests seeking a rustic, off-grid Nelson County experience.",https://nelsoncounty.com/wp-content/uploads/2025/01/The-Chimneys-Exterior.jpg,https://nelsoncounty.com/wp-content/uploads/2025/01/The-Chimneys-Interior.jpg,,https://nelsoncounty.com/explore/the-chimneys/,,"Roseland, VA 22967",Cabins; Adventure; Lodging,FALSE,the-chimneys,josh,2025-02-07,2025-02-07,https://www.google.com/maps/dir/?api=1&destination=Roseland%2C%20VA%2022967
2164,The Carriage House at Stagebridge Farm,Bed and Breakfast,Lovingston,"The Carriage House at Stagebridge Farm is an Airbnb studio above the farm’s workshop with king bed, EV charging, balcony views, and fast Wi-Fi.",https://nelsoncounty.com/wp-content/uploads/2025/01/The-Carriage-House-at-Stagebridge-Farm.jpg,https://nelsoncounty.com/wp-content/uploads/2025/01/The-Carriage-House-at-Stagebridge-Farm-Interior.jpg,,https://nelsoncounty.com/explore/the-carriage-house-at-stagebridge-farm/,,"Stagebridge Farm, Lovingston, VA 22949",Lodging; Wine; Farm; EV Charging; Breakfast; Wi-Fi,FALSE,the-carriage-house-at-stagebridge-farm,josh,2025-02-07,2025-02-07,https://www.google.com/maps/dir/?api=1&destination=Stagebridge%20Farm%2C%20Lovingston%2C%20VA%2022949
2166,Indigo House Bed & Breakfast,Bed and Breakfast,Afton,"Indigo House is a dog-friendly modern B&B with four curated rooms, complimentary breakfast, and direct access to Skyline Drive, Shenandoah NP, and Route 151.",https://nelsoncounty.com/wp-content/uploads/2025/01/The-Indigo-House.jpg,https://nelsoncounty.com/wp-content/uploads/2025/01/The-Indigo-House-Interior.jpg,,https://nelsoncounty.com/explore/indigo-house-bed-breakfast/,(434) 989-6766,"451 Indigo Lane, Afton, VA 22920",Pet Friendly; Breakfast; Scenic Views; Lodging,FALSE,indigo-house-bed-and-breakfast,josh,2025-02-07,2025-02-09,https://www.google.com/maps/dir/?api=1&destination=451%20Indigo%20Lane%2C%20Afton%2C%20VA%2022920
2168,Papa's Cottage,Cabins & Cottages,Afton,"Papa’s Cottage is a mid-century two-bedroom bungalow with private hot tub, updated interiors, and valley views minutes from Route 151 wine country.",https://nelsoncounty.com/wp-content/uploads/2025/01/Papas-Cottage.jpg,https://nelsoncounty.com/wp-content/uploads/2025/01/Papas-Cottage-Interior.jpg,,https://nelsoncounty.com/explore/papas-cottage/,,"Afton, VA 22920",Scenic Views; Wine; Cabins; Lodging,FALSE,papas-cottage,josh,2025-02-07,2025-02-07,https://www.google.com/maps/dir/?api=1&destination=Afton%2C%20VA%2022920
2170,Meme's Cottage,Cabins & Cottages,Afton,"Meme’s Cottage is an updated mid-century getaway for two couples, tucked into woods near Route 151 with modern finishes and quiet deck space.",https://nelsoncounty.com/wp-content/uploads/2025/01/Memes-Cottage.jpg,https://nelsoncounty.com/wp-content/uploads/2025/01/Memes-Cottage-Interior.jpg,,https://nelsoncounty.com/explore/memes-cottage/,,"Afton, VA 22920",Beer; Full Kitchen; Outdoor Seating; Cabins; Lodging,FALSE,memes-cottage,josh,2025-02-07,2025-02-07,https://www.google.com/maps/dir/?api=1&destination=Afton%2C%20VA%2022920
2172,Cheval Circle,Cabins & Cottages,Afton,"Cheval Circle is a rustic three-bedroom home on a meadow beside a horse farm, offering mountain views and easy drives to Afton attractions.",https://nelsoncounty.com/wp-content/uploads/2025/01/Cheval-Circle.jpg,https://nelsoncounty.com/wp-content/uploads/2025/01/Cheval-Circle-Interior.jpg,,https://nelsoncounty.com/explore/cheval-circle/,,"Afton, VA 22920",Farm; Equestrian; Scenic Views; Cabins; Lodging,FALSE,cheval-circle,josh,2025-02-07,2025-02-07,https://www.google.com/maps/dir/?api=1&destination=Afton%2C%20VA%2022920
2174,The Wine Cottage,Cabins & Cottages,Afton,"The Wine Cottage is a mid-century ranch with updated interiors, mountain views, and a private fire pit minutes from Nelson 151 tasting rooms.",https://nelsoncounty.com/wp-content/uploads/2025/01/The-Wine-Cottage.jpg,https://nelsoncounty.com/wp-content/uploads/2025/01/The-Wine-Cottage-Interior.jpg,,https://nelsoncounty.com/explore/the-wine-cottage/,,"Afton, VA 22920",Scenic Views; Tastings; Wine; Cabins; Lodging,FALSE,the-wine-cottage,josh,2025-02-08,2025-02-08,https://www.google.com/maps/dir/?api=1&destination=Afton%2C%20VA%2022920
2178,Carter's Cottage,Cabins & Cottages,Afton,"Carter’s Cottage is a modern farmhouse in downtown Nellysford within walking distance to Three Notch’d, featuring a hot tub and updated open floor plan.",https://nelsoncounty.com/wp-content/uploads/2025/01/Carters-Cottage.jpg,https://nelsoncounty.com/wp-content/uploads/2025/01/Carters-Cottage-Interior.jpg,,https://nelsoncounty.com/explore/carters-cottage/,,"Nellysford, VA 22958",Cabins; Lodging,FALSE,carters-cottage,josh,2025-02-07,2025-02-07,https://www.google.com/maps/dir/?api=1&destination=Nellysford%2C%20VA%2022958
2180,Beech Grove Cottage,Cabins & Cottages,Roseland,"Beech Grove Cottage is a renovated 1920s bungalow across from Devils Backbone with fiber internet, huge yard, and fire pit for six guests.",https://nelsoncounty.com/wp-content/uploads/2025/01/Beech-Grove-Cottage.jpg,https://nelsoncounty.com/wp-content/uploads/2025/01/Beech-Grove-Cottage-Interior.jpg,,https://nelsoncounty.com/explore/beech-grove-cottage/,,"200 Mosbys Run, Roseland, VA 22967",Cabins; Lodging,FALSE,beech-grove-cottage,josh,2025-02-07,2025-02-07,https://www.google.com/maps/dir/?api=1&destination=200%20Mosbys%20Run%2C%20Roseland%2C%20VA%2022967
2182,Montebello Resort,Cabins & Cottages,Montebello,"Montebello Resort offers rustic cabins and cottages with onsite lake, trout pond, country store, and easy access to Crabtree Falls trails.",https://nelsoncounty.com/wp-content/uploads/2025/01/Montebello-Resort.jpg,https://nelsoncounty.com/wp-content/uploads/2025/01/Montebello-Resort-Interior.jpg,,https://nelsoncounty.com/explore/montebello-resort/,(540) 377-2650,"15090 Crabtree Falls Highway, Montebello, VA 24464",Cafe; Retail; Hiking; Cabins; Pet Friendly; Lodging,FALSE,montebello-resort,josh,2025-02-07,2025-03-06,https://www.google.com/maps/dir/?api=1&destination=15090%20Crabtree%20Falls%20Highway%2C%20Montebello%2C%20VA%2024464
2185,Freshwater Field Cabin,Cabins & Cottages,Lovingston,"Freshwater Field Cabin sits on a private farm hollow near Lovingston with hiking trails, horse pastures, and easy drives to Nelson attractions.",https://nelsoncounty.com/wp-content/uploads/2025/01/Freshwater-Field-Cabin.jpg,https://nelsoncounty.com/wp-content/uploads/2025/01/Freshwater-Field-Cabin-Interior.jpg,,https://nelsoncounty.com/explore/freshwater-field-cabin/,,"Lovingston, VA 22949",Farm; Cabins; Equestrian; Lodging,FALSE,freshwater-field-cabin,josh,2025-02-07,2025-02-07,https://www.google.com/maps/dir/?api=1&destination=Lovingston%2C%20VA%2022949
2188,Four Elements Farm,Cabins & Cottages,Roseland,"Four Elements Farm is a 116-acre retreat with farmhouse lodging, hot tub, pond, friendly goats, and proximity to Devils Backbone and Wintergreen.",https://nelsoncounty.com/wp-content/uploads/2025/02/Four-Elements-Farm.jpg,https://nelsoncounty.com/wp-content/uploads/2025/02/Four-Elements-Farm-Interior.jpg,,https://nelsoncounty.com/explore/four-elements-farm/,,"Roseland, VA 22967",Lodging; Farm; Pet Friendly; Cabins,FALSE,four-elements-farm,josh,2025-02-07,2025-08-13,https://www.google.com/maps/dir/?api=1&destination=Roseland%2C%20VA%2022967
2190,Time to Wine Down,Cabins & Cottages,Afton,"Time to Wine Down is a five-bedroom Afton retreat on two acres with dual living rooms, basement game space, air hockey, expansive fire pit, and string-lit outdoor dining near the Route 151 beverage trail.",https://nelsoncounty.com/wp-content/uploads/2025/01/Time-to-Wine-Down.jpg,https://nelsoncounty.com/wp-content/uploads/2025/01/Time-to-Wine-Down-Interior.jpg,,https://nelsoncounty.com/explore/time-to-wine-down/,,"Afton, VA 22920",Outdoor Seating; Wine; Cabins; Lodging,FALSE,time-to-wine-down,josh,2025-02-08,2025-02-11,https://www.google.com/maps/dir/?api=1&destination=Afton%2C%20VA%2022920
2192,Love Afton Cabin,Cabins & Cottages,Afton,"Love Afton Cabin spans 11.5 acres with mountain views, private fishing pond, multiple decks, and entertainment spaces for groups up to 16.",https://nelsoncounty.com/wp-content/uploads/2025/01/Love-Afton-Cabin.jpg,https://nelsoncounty.com/wp-content/uploads/2025/01/Love-Afton-Cabin-Interior.jpg,,https://nelsoncounty.com/explore/love-afton-cabin/,,"5495 Mountain Road, Afton, VA 22920",Outdoor Seating; Scenic Views; Cabins; Lodging; Water Sports,FALSE,love-afton-cabin,josh,2025-02-08,2025-02-11,https://www.google.com/maps/dir/?api=1&destination=5495%20Mountain%20Road%2C%20Afton%2C%20VA%2022920
2194,Meili Mountain,Pet Friendly,Tent Camping,"Meili Mountain offers rustic creekside camping on private land for quiet, leave-no-trace stays near Nelson County trails.",https://nelsoncounty.com/wp-content/uploads/2025/01/Meili-Mountain.jpg,https://nelsoncounty.com/wp-content/uploads/2025/01/Meili-Mountain-2.jpg,,https://nelsoncounty.com/explore/meili-mountain/,,"Nelson County, VA",Scenic Views; Pet Friendly,FALSE,meili-mountain,josh,2025-02-09,2025-02-09,https://www.google.com/maps/dir/?api=1&destination=Nelson%20County%2C%20VA
2196,Adventure Awaits,Pet Friendly,Roseland,"Adventure Awaits is a pet-friendly Wintergreen home two minutes from the slopes with hot tub, fire pit, multiple living areas, and five smart TVs.",https://nelsoncounty.com/wp-content/uploads/2025/01/Adventure-Awaits.jpg,https://nelsoncounty.com/wp-content/uploads/2025/01/Adventure-Awaits-Interior.jpg,,https://nelsoncounty.com/explore/adventure-awaits/,,"Wintergreen Resort, Roseland, VA 22967",Scenic Views; Pet Friendly; Skiing,FALSE,adventure-awaits,josh,2025-02-08,2025-02-11,https://www.google.com/maps/dir/?api=1&destination=Wintergreen%20Resort%2C%20Roseland%2C%20VA%2022967
2198,Wintergreen Ridge Retreat,Pet Friendly,Wintergreen Resort,"Wintergreen Ridge Retreat is a four-bedroom mountain home sleeping ten with expansive decks, hot tub, and easy access to Wintergreen lifts and trails.",https://nelsoncounty.com/wp-content/uploads/2025/01/Wintergreen-Ridge-Retreat-Interior.jpg,https://nelsoncounty.com/wp-content/uploads/2025/01/Wintergreen-Ridge-Retreat.jpg,,https://nelsoncounty.com/explore/wintergreen-ridge-retreat/,,"Wintergreen Resort, Nellysford, VA 22958",Outdoor Seating; Scenic Views; Pet Friendly,FALSE,wintergreen-ridge-retreat,josh,2025-02-08,2025-05-30,https://www.google.com/maps/dir/?api=1&destination=Wintergreen%20Resort%2C%20Nellysford%2C%20VA%2022958
